var,status,component,license,usage,categorisation,service,user,repo,regex,dl,source,comment
[[cmder]],enabled,[[http://cmder.net/][Cmder]],[[https://github.com/cmderdev/cmder#license][MIT]],console emulator & cmd replacement,Standalone Tool,github-release,cmderdev,cmder,cmder.7z,,,
[[emacs]],enabled,[[https://www.gnu.org/software/emacs/][emacs]] & [[https://orgmode.org/][org-mode]],[[https://github.com/zklhp/emacs-w64/blob/emacs-25/COPYING][GPL-3.0]],"task & information management, text editor, IDE, composing documentation",Loosely Coupled with internal code (e.g. internal REST APIs),apache-dir-dl,,,emacs-(\d*\.\d+)*?-x86_64\.zip(?![\.]),,https://ftp.gnu.org/gnu/emacs/windows/,
[[doom-emacs]],enabled,[[https://github.com/hlissner/doom-emacs][doom-emacs]],[[https://github.com/hlissner/doom-emacs/blob/master/LICENSE][MIT]],configuration framework for emacs,Loosely Coupled with internal code (e.g. internal REST APIs),github-clone,hlissner,doom-emacs,,,,
[[autohotkey]],disabled,[[https://autohotkey.com/][AutoHotKey]],[[https://github.com/Lexikos/AutoHotkey_L/blob/master/license.txt][GPL-2.0]],"general Windows automation, expanding commonly used text snippets",Standalone Tool,apache-dir-dl,,,AutoHotkey_(\d*\.\d+)*?.*(?=\.zip),,https://autohotkey.com/download/1.1/,1.1 download folder as root folder takes us to 2.0 which isnt as advanced yet/no backwards compatibility for AHK v1 scripts
[[knime]],disabled,[[https://www.knime.com/knime-analytics-platform][KNIME Analytics Platform]],[[https://www.knime.com/downloads/full-license][GPL-3.0]],"data pipelines, transformation, automation & reporting",Loosely Coupled with internal code (e.g. internal REST APIs),direct-dl,,,,https://download.knime.org/analytics-platform/win/knime-latest-win32.win32.x86_64.zip,,
[[rawgraphs]],disabled,[[http://rawgraphs.io/][RAWGraphs]],[[https://github.com/densitydesign/raw/blob/master/LICENSE][Apache-2.0]],additional data visualisation options,Standalone Tool,github-clone,densitydesign,raw,,,,
[[winpython]],disabled,[[https://winpython.github.io/][WinPython]],[[https://github.com/winpython/winpython/blob/master/LICENSE][MIT]],portable python runtime to support Apache Superset & data science applications,Standalone Tool,github-release,winpython,winpython,WinPython64-(\d*\.\d+)*?(?=Zero\.exe),,,
[[superset]],disabled,[[https://superset.incubator.apache.org/][Apache Superset]],[[https://github.com/apache/incubator-superset/blob/master/LICENSE.txt][Apache-2.0]],"data exploration, dashboards & data visualisation",Standalone Tool,github-clone,apache,incubator-superset,,,,
[[spacemacs]],disabled,[[http://spacemacs.org/][spacemacs (+layers)]],[[https://github.com/zklhp/emacs-w64/blob/emacs-25/COPYING][GPL-3.0]],enhancement to emacs (see above for usage),Loosely Coupled with internal code (e.g. internal REST APIs),github-clone,syl20bnr,spacemacs,,,,
